{"certificate_id":"cert.agent_stage8_1_01_direct","contract_id":"contract.01_complete_success","contract_sha256":"03a4f6826798da4effb7b950b1c64d4a851267ab93378e9bb1598a85e667b843","costs":{"bytes_read":2843,"capture_latency_ms":13.25596,"inspection_latency_ms":0.85557,"planner_latency_ms":2.549866},"created_at":"2026-10-25T07:24:49.638995Z","decision_status":"normal","epoch_id":"stage8_1_01_direct","evidence_refs":["obs.agent_stage8_1_01_direct.student_state.1","obs.agent_stage8_1_01_direct.report_state.2","obs.agent_stage8_1_01_direct.full_frame_diff.3","obs.agent_stage8_1_01_direct.validation_trace.4"],"inspection_ids":["student_state","report_state","full_frame_diff","validation_trace"],"mode":"conservative","obligation_results":[{"evidence_refs":["obs.agent_stage8_1_01_direct.student_state.1"],"obligation_id":"marks_correct","reason_code":"predicate_supported","truth":"pass"},{"evidence_refs":["obs.agent_stage8_1_01_direct.student_state.1"],"obligation_id":"exact_record_count","reason_code":"predicate_supported","truth":"pass"},{"evidence_refs":["obs.agent_stage8_1_01_direct.report_state.2"],"obligation_id":"report_exists","reason_code":"predicate_supported","truth":"pass"},{"evidence_refs":["obs.agent_stage8_1_01_direct.report_state.2"],"obligation_id":"report_matches_database","reason_code":"predicate_supported","truth":"pass"},{"evidence_refs":["obs.agent_stage8_1_01_direct.full_frame_diff.3"],"obligation_id":"no_unauthorized_mutation","reason_code":"predicate_supported","truth":"pass"},{"evidence_refs":["obs.agent_stage8_1_01_direct.validation_trace.4"],"obligation_id":"validation_before_update","reason_code":"predicate_supported","truth":"pass"}],"reason_codes":["all_obligations_supported"],"run_id":"agent_stage8_1_01_direct","schema_version":"1.0","trust_assumptions":["Independent read-only evidence adapters; consistent named epoch; declared scope only.","Contract adequacy and capture isolation are assumed, not proven."],"unresolved_obligation_ids":[],"verdict":"PASS","verified_frame_surfaces":["filesystem.reports","sqlite.students"]}
