{"certificate_id":"cert.study.refund_and_restock.no_op","contract_id":"agentsynth.refund_and_restock","contract_sha256":"5d914fa9107c653d1eab72a48d297d752cae076cd4e6417d0c55eb85a6bf2a32","costs":{"bytes_read":3328,"capture_latency_ms":0.0,"inspection_latency_ms":0.0,"planner_latency_ms":1.095219},"created_at":"2026-10-25T10:56:25.068614Z","decision_status":"normal","epoch_id":"epoch.refund_and_restock.no_op","evidence_refs":["obs.study.refund_and_restock.no_op.outcome_readback","obs.study.refund_and_restock.no_op.closed_world_diff"],"inspection_ids":["outcome_readback","closed_world_diff"],"mode":"conservative","obligation_results":[{"evidence_refs":["obs.study.refund_and_restock.no_op.outcome_readback"],"obligation_id":"checker_0","reason_code":"outcome_predicate_violated","truth":"fail"},{"evidence_refs":["obs.study.refund_and_restock.no_op.outcome_readback"],"obligation_id":"checker_1","reason_code":"predicate_supported","truth":"pass"},{"evidence_refs":["obs.study.refund_and_restock.no_op.outcome_readback"],"obligation_id":"checker_2","reason_code":"outcome_predicate_violated","truth":"fail"},{"evidence_refs":["obs.study.refund_and_restock.no_op.outcome_readback"],"obligation_id":"checker_3","reason_code":"outcome_predicate_violated","truth":"fail"},{"evidence_refs":["obs.study.refund_and_restock.no_op.closed_world_diff"],"obligation_id":"no_unauthorized_mutation","reason_code":"predicate_supported","truth":"pass"}],"reason_codes":["outcome_predicate_violated"],"run_id":"study.refund_and_restock.no_op","schema_version":"1.0","trust_assumptions":["Controlled local execution of externally authored benchmark SQL tasks; scripted oracle/faults, not LLM trajectories.","Observation adapter independently computes facts from captured SQLite snapshots; no agent access to verifier.","Complete row/field diff within the enumerated SQLite tables; transient writes and external effects are not covered.","Upstream SQL checkers are reproduced, but this is not the official AgentSynth CLI scoring pipeline."],"unresolved_obligation_ids":[],"verdict":"FAIL","verified_frame_surfaces":["sqlite.inventory","sqlite.order_items","sqlite.orders"]}
