{"certificate_id":"cert.run.08_conflicting_evidence","contract_id":"contract.08_conflicting_evidence","contract_sha256":"5d4e336f026153f77e0ebe358b947d9aa25b47a14afb7ce7ecd85942dd78598a","costs":{"bytes_read":102100,"capture_latency_ms":0.0,"inspection_latency_ms":27.2,"planner_latency_ms":1.590728},"created_at":"2026-10-24T16:27:43.312602Z","decision_status":"evidence_conflict","epoch_id":"run.epoch.20261024","evidence_refs":["obs.08_conflicting_evidence.student_state.0","obs.08_conflicting_evidence.report_state.0","obs.08_conflicting_evidence.full_frame_diff.0","obs.08_conflicting_evidence.validation_trace.0","obs.08_conflicting_evidence.conflict"],"inspection_ids":["student_state","report_state","full_frame_diff","validation_trace"],"mode":"conservative","obligation_results":[{"evidence_refs":["obs.08_conflicting_evidence.conflict","obs.08_conflicting_evidence.student_state.0"],"obligation_id":"marks_correct","reason_code":"evidence_conflict","truth":"unknown"},{"evidence_refs":["obs.08_conflicting_evidence.conflict","obs.08_conflicting_evidence.student_state.0"],"obligation_id":"exact_record_count","reason_code":"predicate_supported","truth":"pass"},{"evidence_refs":["obs.08_conflicting_evidence.report_state.0"],"obligation_id":"report_exists","reason_code":"predicate_supported","truth":"pass"},{"evidence_refs":["obs.08_conflicting_evidence.report_state.0"],"obligation_id":"report_matches_database","reason_code":"predicate_supported","truth":"pass"},{"evidence_refs":["obs.08_conflicting_evidence.full_frame_diff.0"],"obligation_id":"no_unauthorized_mutation","reason_code":"predicate_supported","truth":"pass"},{"evidence_refs":["obs.08_conflicting_evidence.validation_trace.0"],"obligation_id":"validation_before_update","reason_code":"predicate_supported","truth":"pass"}],"reason_codes":["evidence_conflict"],"run_id":"run.08_conflicting_evidence","schema_version":"1.0","trust_assumptions":["REFERENCE FIXTURE ONLY: snapshot receipts are simulated and not verified against live state.","Preauthored facts serve specification testing; not evidence of real agent task completion."],"unresolved_obligation_ids":["marks_correct"],"verdict":"UNCERTAIN","verified_frame_surfaces":["filesystem.reports","sqlite.students"]}
