{"certificate_id":"cert.run.11_benign_alternative_path","contract_id":"contract.11_benign_alternative_path","contract_sha256":"7c218578fa530774080b04cc4433d2aabe5a7f550393676a269952dea64c9d61","costs":{"bytes_read":101900,"capture_latency_ms":0.0,"inspection_latency_ms":26.0,"planner_latency_ms":3.114238},"created_at":"2026-10-24T16:39:08.435431Z","decision_status":"normal","epoch_id":"run.epoch.20261024","evidence_refs":["obs.11_benign_alternative_path.student_state.0","obs.11_benign_alternative_path.report_state.0","obs.11_benign_alternative_path.full_frame_diff.0","obs.11_benign_alternative_path.validation_trace.0"],"inspection_ids":["student_state","report_state","full_frame_diff","validation_trace"],"mode":"bounded_exact","obligation_results":[{"evidence_refs":["obs.11_benign_alternative_path.student_state.0"],"obligation_id":"marks_correct","reason_code":"predicate_supported","truth":"pass"},{"evidence_refs":["obs.11_benign_alternative_path.student_state.0"],"obligation_id":"exact_record_count","reason_code":"predicate_supported","truth":"pass"},{"evidence_refs":["obs.11_benign_alternative_path.report_state.0"],"obligation_id":"report_exists","reason_code":"predicate_supported","truth":"pass"},{"evidence_refs":["obs.11_benign_alternative_path.report_state.0"],"obligation_id":"report_matches_database","reason_code":"predicate_supported","truth":"pass"},{"evidence_refs":["obs.11_benign_alternative_path.full_frame_diff.0"],"obligation_id":"no_unauthorized_mutation","reason_code":"predicate_supported","truth":"pass"},{"evidence_refs":["obs.11_benign_alternative_path.validation_trace.0"],"obligation_id":"validation_before_update","reason_code":"predicate_supported","truth":"pass"}],"reason_codes":["all_compatible_worlds_satisfy_contract"],"run_id":"run.11_benign_alternative_path","schema_version":"1.0","trust_assumptions":["Research fixture only. Authored facts and simulated coverage are not operational evidence.","Finite model model.reference.11_benign_alternative_path SHA256 167f2eb5dbce1a01014e7d229930fd44752716dcb0d0c1901bd43515ca41a147 is reviewed external input, not ground truth.","Bounded exactness holds only relative to complete declared finite domains and trusted assumptions."],"unresolved_obligation_ids":[],"verdict":"PASS","verified_frame_surfaces":["filesystem.reports","sqlite.students"]}
