{"certificate_id":"cert.study.store_credit_return.oracle","contract_id":"agentsynth.store_credit_return","contract_sha256":"612032a0f704a9bb3e475aa4df8a85c19530194eea7ac2f7b3f22626c6068a78","costs":{"bytes_read":3086,"capture_latency_ms":0.0,"inspection_latency_ms":0.0,"planner_latency_ms":1.050922},"created_at":"2026-10-25T10:56:25.245459Z","decision_status":"normal","epoch_id":"epoch.store_credit_return.oracle","evidence_refs":["obs.study.store_credit_return.oracle.outcome_readback","obs.study.store_credit_return.oracle.closed_world_diff"],"inspection_ids":["outcome_readback","closed_world_diff"],"mode":"conservative","obligation_results":[{"evidence_refs":["obs.study.store_credit_return.oracle.outcome_readback"],"obligation_id":"checker_0","reason_code":"predicate_supported","truth":"pass"},{"evidence_refs":["obs.study.store_credit_return.oracle.outcome_readback"],"obligation_id":"checker_1","reason_code":"predicate_supported","truth":"pass"},{"evidence_refs":["obs.study.store_credit_return.oracle.outcome_readback"],"obligation_id":"checker_2","reason_code":"predicate_supported","truth":"pass"},{"evidence_refs":["obs.study.store_credit_return.oracle.outcome_readback"],"obligation_id":"checker_3","reason_code":"predicate_supported","truth":"pass"},{"evidence_refs":["obs.study.store_credit_return.oracle.closed_world_diff"],"obligation_id":"no_unauthorized_mutation","reason_code":"predicate_supported","truth":"pass"}],"reason_codes":["all_obligations_supported"],"run_id":"study.store_credit_return.oracle","schema_version":"1.0","trust_assumptions":["Controlled local execution of externally authored benchmark SQL tasks; scripted oracle/faults, not LLM trajectories.","Observation adapter independently computes facts from captured SQLite snapshots; no agent access to verifier.","Complete row/field diff within the enumerated SQLite tables; transient writes and external effects are not covered.","Upstream SQL checkers are reproduced, but this is not the official AgentSynth CLI scoring pipeline."],"unresolved_obligation_ids":[],"verdict":"PASS","verified_frame_surfaces":["sqlite.customers","sqlite.orders"]}
