{"certificate_id":"cert.run.stage2.missing_validation","contract_id":"contract.01_complete_success","contract_sha256":"03a4f6826798da4effb7b950b1c64d4a851267ab93378e9bb1598a85e667b843","costs":{"bytes_read":2650,"capture_latency_ms":3.17574,"inspection_latency_ms":0.47893,"planner_latency_ms":1.358846},"created_at":"2026-10-24T16:39:08.606469Z","decision_status":"normal","epoch_id":"epoch.stage2.missing_validation","evidence_refs":["obs.run.stage2.missing_validation.student_state.1","obs.run.stage2.missing_validation.report_state.2","obs.run.stage2.missing_validation.full_frame_diff.3","obs.run.stage2.missing_validation.validation_trace.4"],"inspection_ids":["student_state","report_state","full_frame_diff","validation_trace"],"mode":"conservative","obligation_results":[{"evidence_refs":["obs.run.stage2.missing_validation.student_state.1"],"obligation_id":"marks_correct","reason_code":"predicate_supported","truth":"pass"},{"evidence_refs":["obs.run.stage2.missing_validation.student_state.1"],"obligation_id":"exact_record_count","reason_code":"predicate_supported","truth":"pass"},{"evidence_refs":["obs.run.stage2.missing_validation.report_state.2"],"obligation_id":"report_exists","reason_code":"predicate_supported","truth":"pass"},{"evidence_refs":["obs.run.stage2.missing_validation.report_state.2"],"obligation_id":"report_matches_database","reason_code":"predicate_supported","truth":"pass"},{"evidence_refs":["obs.run.stage2.missing_validation.full_frame_diff.3"],"obligation_id":"no_unauthorized_mutation","reason_code":"predicate_supported","truth":"pass"},{"evidence_refs":["obs.run.stage2.missing_validation.validation_trace.4"],"obligation_id":"validation_before_update","reason_code":"process_precedence_violated","truth":"fail"}],"reason_codes":["process_precedence_violated"],"run_id":"run.stage2.missing_validation","schema_version":"1.0","trust_assumptions":["Stage 2 controlled quiescent evidence sandbox; non-atomic across heterogeneous services."],"unresolved_obligation_ids":[],"verdict":"FAIL","verified_frame_surfaces":["filesystem.reports","sqlite.students"]}
