{"certificate_id":"cert.run.04_duplicate_record","contract_id":"contract.04_duplicate_record","contract_sha256":"5b1e091fd315298c3548e2d90e9aceadc356166026c288d4c5ab0755cbe2633e","costs":{"bytes_read":101900,"capture_latency_ms":0.0,"inspection_latency_ms":26.0,"planner_latency_ms":1.37537},"created_at":"2026-10-24T16:27:43.298850Z","decision_status":"normal","epoch_id":"run.epoch.20261024","evidence_refs":["obs.04_duplicate_record.student_state.0","obs.04_duplicate_record.report_state.0","obs.04_duplicate_record.full_frame_diff.0","obs.04_duplicate_record.validation_trace.0"],"inspection_ids":["student_state","report_state","full_frame_diff","validation_trace"],"mode":"conservative","obligation_results":[{"evidence_refs":["obs.04_duplicate_record.student_state.0"],"obligation_id":"marks_correct","reason_code":"predicate_supported","truth":"pass"},{"evidence_refs":["obs.04_duplicate_record.student_state.0"],"obligation_id":"exact_record_count","reason_code":"record_multiplicity_violation","truth":"fail"},{"evidence_refs":["obs.04_duplicate_record.report_state.0"],"obligation_id":"report_exists","reason_code":"predicate_supported","truth":"pass"},{"evidence_refs":["obs.04_duplicate_record.report_state.0"],"obligation_id":"report_matches_database","reason_code":"predicate_supported","truth":"pass"},{"evidence_refs":["obs.04_duplicate_record.full_frame_diff.0"],"obligation_id":"no_unauthorized_mutation","reason_code":"predicate_supported","truth":"pass"},{"evidence_refs":["obs.04_duplicate_record.validation_trace.0"],"obligation_id":"validation_before_update","reason_code":"predicate_supported","truth":"pass"}],"reason_codes":["record_multiplicity_violation"],"run_id":"run.04_duplicate_record","schema_version":"1.0","trust_assumptions":["REFERENCE FIXTURE ONLY: snapshot receipts are simulated and not verified against live state.","Preauthored facts serve specification testing; not evidence of real agent task completion."],"unresolved_obligation_ids":[],"verdict":"FAIL","verified_frame_surfaces":["filesystem.reports","sqlite.students"]}
