{"certificate_id":"cert.run.stage2.silent_noop","contract_id":"contract.01_complete_success","contract_sha256":"03a4f6826798da4effb7b950b1c64d4a851267ab93378e9bb1598a85e667b843","costs":{"bytes_read":2811,"capture_latency_ms":2.85343,"inspection_latency_ms":0.55638,"planner_latency_ms":1.330835},"created_at":"2026-10-24T16:39:08.552946Z","decision_status":"normal","epoch_id":"epoch.stage2.silent_noop","evidence_refs":["obs.run.stage2.silent_noop.student_state.1","obs.run.stage2.silent_noop.report_state.2","obs.run.stage2.silent_noop.full_frame_diff.3","obs.run.stage2.silent_noop.validation_trace.4"],"inspection_ids":["student_state","report_state","full_frame_diff","validation_trace"],"mode":"conservative","obligation_results":[{"evidence_refs":["obs.run.stage2.silent_noop.student_state.1"],"obligation_id":"marks_correct","reason_code":"required_value_mismatch","truth":"fail"},{"evidence_refs":["obs.run.stage2.silent_noop.student_state.1"],"obligation_id":"exact_record_count","reason_code":"predicate_supported","truth":"pass"},{"evidence_refs":["obs.run.stage2.silent_noop.report_state.2"],"obligation_id":"report_exists","reason_code":"predicate_supported","truth":"pass"},{"evidence_refs":["obs.run.stage2.silent_noop.report_state.2"],"obligation_id":"report_matches_database","reason_code":"cross_artifact_mismatch","truth":"fail"},{"evidence_refs":["obs.run.stage2.silent_noop.full_frame_diff.3"],"obligation_id":"no_unauthorized_mutation","reason_code":"predicate_supported","truth":"pass"},{"evidence_refs":["obs.run.stage2.silent_noop.validation_trace.4"],"obligation_id":"validation_before_update","reason_code":"predicate_supported","truth":"pass"}],"reason_codes":["cross_artifact_mismatch","required_value_mismatch"],"run_id":"run.stage2.silent_noop","schema_version":"1.0","trust_assumptions":["Stage 2 controlled quiescent evidence sandbox; non-atomic across heterogeneous services."],"unresolved_obligation_ids":[],"verdict":"FAIL","verified_frame_surfaces":["filesystem.reports","sqlite.students"]}
