{"certificate_id":"cert.g3_real_raise-ticket-priority_s42","contract_id":"agentsynth.raise_ticket_priority","contract_sha256":"11ba197fb279075e81f3c1b8d751fc6e3f16a0c71c389a9b002908995d03a3fb","costs":{"bytes_read":3592,"capture_latency_ms":0.0,"inspection_latency_ms":0.0,"planner_latency_ms":14.1329},"created_at":"2026-10-25T12:44:34.315039Z","decision_status":"normal","epoch_id":"epoch.raise-ticket-priority.1792932253418","evidence_refs":["obs.g3_real_raise-ticket-priority_s42.outcome_readback","obs.g3_real_raise-ticket-priority_s42.closed_world_diff","obs.g3_real_raise-ticket-priority_s42.trace_and_answer_check"],"inspection_ids":["outcome_readback","closed_world_diff","trace_and_answer_check"],"mode":"conservative","obligation_results":[{"evidence_refs":["obs.g3_real_raise-ticket-priority_s42.outcome_readback"],"obligation_id":"checker_0","reason_code":"predicate_supported","truth":"pass"},{"evidence_refs":["obs.g3_real_raise-ticket-priority_s42.outcome_readback"],"obligation_id":"checker_1","reason_code":"predicate_supported","truth":"pass"},{"evidence_refs":["obs.g3_real_raise-ticket-priority_s42.closed_world_diff"],"obligation_id":"no_unauthorized_mutation","reason_code":"predicate_supported","truth":"pass"}],"reason_codes":["all_obligations_supported"],"run_id":"g3_real_raise-ticket-priority_s42","schema_version":"1.0","trust_assumptions":["AURA Stage 8.3 independent AgentSynth runtime adapter.","SQLite online snapshot pairs taken before and after agent rollout.","Inspection noninterference verified by pre/post hash matching.","Strict closed-world allowlists enforce absence of persistent collateral edits.","Agent self-reported success is unverified and untrusted."],"unresolved_obligation_ids":[],"verdict":"PASS","verified_frame_surfaces":["sqlite.tickets"]}
