{"certificate_id":"cert.run.05_unobservable_notification","contract_id":"contract.05_unobservable_notification","contract_sha256":"3685c6fb8ac267757245e8f2dadd6e38bf11c5f76db78167a33e4569e1f42210","costs":{"bytes_read":101900,"capture_latency_ms":0.0,"inspection_latency_ms":76.0,"planner_latency_ms":1.613853},"created_at":"2026-10-24T16:39:08.386250Z","decision_status":"normal","epoch_id":"run.epoch.20261024","evidence_refs":["obs.05_unobservable_notification.student_state.0","obs.05_unobservable_notification.report_state.0","obs.05_unobservable_notification.full_frame_diff.0","obs.05_unobservable_notification.validation_trace.0","obs.05_unobservable_notification.notification_status.0"],"inspection_ids":["student_state","report_state","full_frame_diff","validation_trace","notification_status"],"mode":"conservative","obligation_results":[{"evidence_refs":["obs.05_unobservable_notification.student_state.0"],"obligation_id":"marks_correct","reason_code":"predicate_supported","truth":"pass"},{"evidence_refs":["obs.05_unobservable_notification.student_state.0"],"obligation_id":"exact_record_count","reason_code":"predicate_supported","truth":"pass"},{"evidence_refs":["obs.05_unobservable_notification.report_state.0"],"obligation_id":"report_exists","reason_code":"predicate_supported","truth":"pass"},{"evidence_refs":["obs.05_unobservable_notification.report_state.0"],"obligation_id":"report_matches_database","reason_code":"predicate_supported","truth":"pass"},{"evidence_refs":["obs.05_unobservable_notification.full_frame_diff.0"],"obligation_id":"no_unauthorized_mutation","reason_code":"predicate_supported","truth":"pass"},{"evidence_refs":["obs.05_unobservable_notification.validation_trace.0"],"obligation_id":"validation_before_update","reason_code":"predicate_supported","truth":"pass"},{"evidence_refs":["obs.05_unobservable_notification.notification_status.0"],"obligation_id":"notification_confirmed","reason_code":"unconfirmed_external_effect","truth":"unknown"}],"reason_codes":["unconfirmed_external_effect"],"run_id":"run.05_unobservable_notification","schema_version":"1.0","trust_assumptions":["Research fixture only. Authored facts and simulated coverage are not operational evidence."],"unresolved_obligation_ids":["notification_confirmed"],"verdict":"UNCERTAIN","verified_frame_surfaces":["filesystem.reports","sqlite.students"]}
