{"certificate_id":"cert.run.12_external_frame_unobserved","contract_id":"contract.12_external_frame_unobserved","contract_sha256":"12e68549cc734cfff7bd804ba9bb521463e8352c491a13d5f1f16f0ae98e9c06","costs":{"bytes_read":101900,"capture_latency_ms":0.0,"inspection_latency_ms":126.0,"planner_latency_ms":1.639241},"created_at":"2026-10-24T16:39:08.441650Z","decision_status":"normal","epoch_id":"run.epoch.20261024","evidence_refs":["obs.12_external_frame_unobserved.student_state.0","obs.12_external_frame_unobserved.report_state.0","obs.12_external_frame_unobserved.full_frame_diff.0","obs.12_external_frame_unobserved.validation_trace.0","obs.12_external_frame_unobserved.external_ledger_readback.0"],"inspection_ids":["student_state","report_state","full_frame_diff","validation_trace","external_ledger_readback"],"mode":"conservative","obligation_results":[{"evidence_refs":["obs.12_external_frame_unobserved.student_state.0"],"obligation_id":"marks_correct","reason_code":"predicate_supported","truth":"pass"},{"evidence_refs":["obs.12_external_frame_unobserved.student_state.0"],"obligation_id":"exact_record_count","reason_code":"predicate_supported","truth":"pass"},{"evidence_refs":["obs.12_external_frame_unobserved.report_state.0"],"obligation_id":"report_exists","reason_code":"predicate_supported","truth":"pass"},{"evidence_refs":["obs.12_external_frame_unobserved.report_state.0"],"obligation_id":"report_matches_database","reason_code":"predicate_supported","truth":"pass"},{"evidence_refs":["obs.12_external_frame_unobserved.full_frame_diff.0"],"obligation_id":"no_unauthorized_mutation","reason_code":"frame_coverage_incomplete","truth":"unknown"},{"evidence_refs":["obs.12_external_frame_unobserved.validation_trace.0"],"obligation_id":"validation_before_update","reason_code":"predicate_supported","truth":"pass"},{"evidence_refs":["obs.12_external_frame_unobserved.external_ledger_readback.0"],"obligation_id":"external_ledger_clean","reason_code":"external_frame_unobserved","truth":"unknown"}],"reason_codes":["external_frame_unobserved","frame_coverage_incomplete"],"run_id":"run.12_external_frame_unobserved","schema_version":"1.0","trust_assumptions":["Research fixture only. Authored facts and simulated coverage are not operational evidence."],"unresolved_obligation_ids":["external_ledger_clean","no_unauthorized_mutation"],"verdict":"UNCERTAIN","verified_frame_surfaces":["filesystem.reports","sqlite.students"]}
