{"certificate_id":"cert.run.08_conflicting_evidence","contract_id":"contract.08_conflicting_evidence","contract_sha256":"5d4e336f026153f77e0ebe358b947d9aa25b47a14afb7ce7ecd85942dd78598a","costs":{"bytes_read":102100,"capture_latency_ms":0.0,"inspection_latency_ms":27.2,"planner_latency_ms":3.143592},"created_at":"2026-10-24T16:39:08.411311Z","decision_status":"evidence_conflict","epoch_id":"run.epoch.20261024","evidence_refs":["obs.08_conflicting_evidence.student_state.0","obs.08_conflicting_evidence.report_state.0","obs.08_conflicting_evidence.full_frame_diff.0","obs.08_conflicting_evidence.validation_trace.0","obs.08_conflicting_evidence.conflict"],"inspection_ids":["student_state","report_state","full_frame_diff","validation_trace"],"mode":"bounded_exact","obligation_results":[{"evidence_refs":["obs.08_conflicting_evidence.conflict","obs.08_conflicting_evidence.student_state.0"],"obligation_id":"marks_correct","reason_code":"evidence_conflict","truth":"unknown"},{"evidence_refs":["obs.08_conflicting_evidence.conflict","obs.08_conflicting_evidence.student_state.0"],"obligation_id":"exact_record_count","reason_code":"predicate_supported","truth":"pass"},{"evidence_refs":["obs.08_conflicting_evidence.report_state.0"],"obligation_id":"report_exists","reason_code":"predicate_supported","truth":"pass"},{"evidence_refs":["obs.08_conflicting_evidence.report_state.0"],"obligation_id":"report_matches_database","reason_code":"predicate_supported","truth":"pass"},{"evidence_refs":["obs.08_conflicting_evidence.full_frame_diff.0"],"obligation_id":"no_unauthorized_mutation","reason_code":"predicate_supported","truth":"pass"},{"evidence_refs":["obs.08_conflicting_evidence.validation_trace.0"],"obligation_id":"validation_before_update","reason_code":"predicate_supported","truth":"pass"}],"reason_codes":["evidence_conflict"],"run_id":"run.08_conflicting_evidence","schema_version":"1.0","trust_assumptions":["Research fixture only. Authored facts and simulated coverage are not operational evidence.","Finite model model.reference.08_conflicting_evidence SHA256 2f1297a1fdf340b0516b8972249006755ac93d85961cced369bf425fc8ed3e9f is reviewed external input, not ground truth.","Bounded exactness holds only relative to complete declared finite domains and trusted assumptions."],"unresolved_obligation_ids":["marks_correct"],"verdict":"UNCERTAIN","verified_frame_surfaces":["filesystem.reports","sqlite.students"]}
