{"certificate_id":"cert.run.07_insufficient_frame_coverage","contract_id":"contract.07_insufficient_frame_coverage","contract_sha256":"896c22e92a0e6dc75fc9cc1d83af2709a700552f82798467e1bfa1a938dee9cf","costs":{"bytes_read":1900,"capture_latency_ms":0.0,"inspection_latency_ms":6.0,"planner_latency_ms":2.527853},"created_at":"2026-10-24T16:39:08.403309Z","decision_status":"normal","epoch_id":"run.epoch.20261024","evidence_refs":["obs.07_insufficient_frame_coverage.student_state.0","obs.07_insufficient_frame_coverage.report_state.0","obs.07_insufficient_frame_coverage.validation_trace.0"],"inspection_ids":["student_state","report_state","validation_trace"],"mode":"bounded_exact","obligation_results":[{"evidence_refs":["obs.07_insufficient_frame_coverage.student_state.0"],"obligation_id":"marks_correct","reason_code":"predicate_supported","truth":"pass"},{"evidence_refs":["obs.07_insufficient_frame_coverage.student_state.0"],"obligation_id":"exact_record_count","reason_code":"predicate_supported","truth":"pass"},{"evidence_refs":["obs.07_insufficient_frame_coverage.report_state.0"],"obligation_id":"report_exists","reason_code":"predicate_supported","truth":"pass"},{"evidence_refs":["obs.07_insufficient_frame_coverage.report_state.0"],"obligation_id":"report_matches_database","reason_code":"predicate_supported","truth":"pass"},{"evidence_refs":[],"obligation_id":"no_unauthorized_mutation","reason_code":"missing_required_coverage","truth":"unknown"},{"evidence_refs":["obs.07_insufficient_frame_coverage.validation_trace.0"],"obligation_id":"validation_before_update","reason_code":"predicate_supported","truth":"pass"}],"reason_codes":["missing_required_coverage"],"run_id":"run.07_insufficient_frame_coverage","schema_version":"1.0","trust_assumptions":["Research fixture only. Authored facts and simulated coverage are not operational evidence.","Finite model model.reference.07_insufficient_frame_coverage SHA256 82446c152fce486d2d6b3206141263725a1ca86bbfe2997b293c047972efefd6 is reviewed external input, not ground truth.","Bounded exactness holds only relative to complete declared finite domains and trusted assumptions."],"unresolved_obligation_ids":["no_unauthorized_mutation"],"verdict":"UNCERTAIN","verified_frame_surfaces":[]}
