{"certificate_id":"cert.run.02_missing_report","contract_id":"contract.02_missing_report","contract_sha256":"788cc4c931c0b09ff17d7b0e9547fe2b1a049af1e6e7fc51a02366201f242564","costs":{"bytes_read":101900,"capture_latency_ms":0.0,"inspection_latency_ms":26.0,"planner_latency_ms":3.259323},"created_at":"2026-10-24T16:39:08.363532Z","decision_status":"normal","epoch_id":"run.epoch.20261024","evidence_refs":["obs.02_missing_report.student_state.0","obs.02_missing_report.report_state.0","obs.02_missing_report.full_frame_diff.0","obs.02_missing_report.validation_trace.0"],"inspection_ids":["student_state","report_state","full_frame_diff","validation_trace"],"mode":"bounded_exact","obligation_results":[{"evidence_refs":["obs.02_missing_report.student_state.0"],"obligation_id":"marks_correct","reason_code":"predicate_supported","truth":"pass"},{"evidence_refs":["obs.02_missing_report.student_state.0"],"obligation_id":"exact_record_count","reason_code":"predicate_supported","truth":"pass"},{"evidence_refs":["obs.02_missing_report.report_state.0"],"obligation_id":"report_exists","reason_code":"entailed_violation_by_bounded_model","truth":"fail"},{"evidence_refs":["obs.02_missing_report.report_state.0"],"obligation_id":"report_matches_database","reason_code":"entailed_violation_by_bounded_model","truth":"fail"},{"evidence_refs":["obs.02_missing_report.full_frame_diff.0"],"obligation_id":"no_unauthorized_mutation","reason_code":"predicate_supported","truth":"pass"},{"evidence_refs":["obs.02_missing_report.validation_trace.0"],"obligation_id":"validation_before_update","reason_code":"predicate_supported","truth":"pass"}],"reason_codes":["bounded_entailed_violation"],"run_id":"run.02_missing_report","schema_version":"1.0","trust_assumptions":["Research fixture only. Authored facts and simulated coverage are not operational evidence.","Finite model model.reference.02_missing_report SHA256 53ad40c20bf8adb6f3c12966c7bd8564ef9567290383d3491b373e3524b64fd9 is reviewed external input, not ground truth.","Bounded exactness holds only relative to complete declared finite domains and trusted assumptions."],"unresolved_obligation_ids":[],"verdict":"FAIL","verified_frame_surfaces":["filesystem.reports","sqlite.students"]}
