{"certificate_id":"cert.study.reconcile_stock.no_op","contract_id":"agentsynth.reconcile_stock","contract_sha256":"903b3c6bf7abbd087a95aefb10aa3801e6ae6d4b3d7fa51f7a7170bd8bdd6342","costs":{"bytes_read":2990,"capture_latency_ms":0.0,"inspection_latency_ms":0.0,"planner_latency_ms":0.907577},"created_at":"2026-10-25T10:56:25.349339Z","decision_status":"normal","epoch_id":"epoch.reconcile_stock.no_op","evidence_refs":["obs.study.reconcile_stock.no_op.outcome_readback","obs.study.reconcile_stock.no_op.closed_world_diff"],"inspection_ids":["outcome_readback","closed_world_diff"],"mode":"conservative","obligation_results":[{"evidence_refs":["obs.study.reconcile_stock.no_op.outcome_readback"],"obligation_id":"checker_0","reason_code":"outcome_predicate_violated","truth":"fail"},{"evidence_refs":["obs.study.reconcile_stock.no_op.outcome_readback"],"obligation_id":"checker_1","reason_code":"outcome_predicate_violated","truth":"fail"},{"evidence_refs":["obs.study.reconcile_stock.no_op.outcome_readback"],"obligation_id":"checker_2","reason_code":"outcome_predicate_violated","truth":"fail"},{"evidence_refs":["obs.study.reconcile_stock.no_op.closed_world_diff"],"obligation_id":"no_unauthorized_mutation","reason_code":"predicate_supported","truth":"pass"}],"reason_codes":["outcome_predicate_violated"],"run_id":"study.reconcile_stock.no_op","schema_version":"1.0","trust_assumptions":["Controlled local execution of externally authored benchmark SQL tasks; scripted oracle/faults, not LLM trajectories.","Observation adapter independently computes facts from captured SQLite snapshots; no agent access to verifier.","Complete row/field diff within the enumerated SQLite tables; transient writes and external effects are not covered.","Upstream SQL checkers are reproduced, but this is not the official AgentSynth CLI scoring pipeline."],"unresolved_obligation_ids":[],"verdict":"FAIL","verified_frame_surfaces":["sqlite.order_items","sqlite.products"]}
