{"certificate_id":"cert.run.stage2.clean","contract_id":"contract.01_complete_success","contract_sha256":"03a4f6826798da4effb7b950b1c64d4a851267ab93378e9bb1598a85e667b843","costs":{"bytes_read":2775,"capture_latency_ms":3.29364,"inspection_latency_ms":0.53905,"planner_latency_ms":1.300269},"created_at":"2026-10-24T16:27:43.165053Z","decision_status":"normal","epoch_id":"epoch.stage2.clean","evidence_refs":["obs.run.stage2.clean.student_state.1","obs.run.stage2.clean.report_state.2","obs.run.stage2.clean.full_frame_diff.3","obs.run.stage2.clean.validation_trace.4"],"inspection_ids":["student_state","report_state","full_frame_diff","validation_trace"],"mode":"conservative","obligation_results":[{"evidence_refs":["obs.run.stage2.clean.student_state.1"],"obligation_id":"marks_correct","reason_code":"predicate_supported","truth":"pass"},{"evidence_refs":["obs.run.stage2.clean.student_state.1"],"obligation_id":"exact_record_count","reason_code":"predicate_supported","truth":"pass"},{"evidence_refs":["obs.run.stage2.clean.report_state.2"],"obligation_id":"report_exists","reason_code":"predicate_supported","truth":"pass"},{"evidence_refs":["obs.run.stage2.clean.report_state.2"],"obligation_id":"report_matches_database","reason_code":"predicate_supported","truth":"pass"},{"evidence_refs":["obs.run.stage2.clean.full_frame_diff.3"],"obligation_id":"no_unauthorized_mutation","reason_code":"predicate_supported","truth":"pass"},{"evidence_refs":["obs.run.stage2.clean.validation_trace.4"],"obligation_id":"validation_before_update","reason_code":"predicate_supported","truth":"pass"}],"reason_codes":["all_obligations_supported"],"run_id":"run.stage2.clean","schema_version":"1.0","trust_assumptions":["Snapshot/trace evidence originates from the Stage 2 cooperative, quiescent sandbox.","Database+filesystem snapshot is not an atomic distributed-world snapshot.","Verifier-owned artifacts are assumed isolated; hashes alone are not authentication.","Only declared SQLite/filesystem/trace surfaces are covered."],"unresolved_obligation_ids":[],"verdict":"PASS","verified_frame_surfaces":["filesystem.reports","sqlite.students"]}
