{"certificate_id":"cert.study.cancel_and_void_payment.no_op","contract_id":"agentsynth.cancel_and_void_payment","contract_sha256":"60a6bbe5f7cec133ade5fd4d3cf8064648f6097ed7c13580ac11cbaf14b8a5c4","costs":{"bytes_read":2960,"capture_latency_ms":0.0,"inspection_latency_ms":0.0,"planner_latency_ms":1.034688},"created_at":"2026-10-25T10:56:25.168137Z","decision_status":"normal","epoch_id":"epoch.cancel_and_void_payment.no_op","evidence_refs":["obs.study.cancel_and_void_payment.no_op.outcome_readback","obs.study.cancel_and_void_payment.no_op.closed_world_diff"],"inspection_ids":["outcome_readback","closed_world_diff"],"mode":"conservative","obligation_results":[{"evidence_refs":["obs.study.cancel_and_void_payment.no_op.outcome_readback"],"obligation_id":"checker_0","reason_code":"outcome_predicate_violated","truth":"fail"},{"evidence_refs":["obs.study.cancel_and_void_payment.no_op.outcome_readback"],"obligation_id":"checker_1","reason_code":"outcome_predicate_violated","truth":"fail"},{"evidence_refs":["obs.study.cancel_and_void_payment.no_op.outcome_readback"],"obligation_id":"checker_2","reason_code":"predicate_supported","truth":"pass"},{"evidence_refs":["obs.study.cancel_and_void_payment.no_op.outcome_readback"],"obligation_id":"checker_3","reason_code":"predicate_supported","truth":"pass"},{"evidence_refs":["obs.study.cancel_and_void_payment.no_op.closed_world_diff"],"obligation_id":"no_unauthorized_mutation","reason_code":"predicate_supported","truth":"pass"}],"reason_codes":["outcome_predicate_violated"],"run_id":"study.cancel_and_void_payment.no_op","schema_version":"1.0","trust_assumptions":["Controlled local execution of externally authored benchmark SQL tasks; scripted oracle/faults, not LLM trajectories.","Observation adapter independently computes facts from captured SQLite snapshots; no agent access to verifier.","Complete row/field diff within the enumerated SQLite tables; transient writes and external effects are not covered.","Upstream SQL checkers are reproduced, but this is not the official AgentSynth CLI scoring pipeline."],"unresolved_obligation_ids":[],"verdict":"FAIL","verified_frame_surfaces":["sqlite.orders","sqlite.payments"]}
